[{"source_id":"SRC-HANUS-2016","year":2016,"authors":"Hanuš et al.","title":"Phytocannabinoids: a unified critical inventory","doi":"10.1039/C6NP00074F","url":"https://doi.org/10.1039/C6NP00074F","use":"Biogenetic framework; transformation/artifact caution; historical critical inventory."},{"source_id":"SRC-RADWAN-2021","year":2021,"authors":"Radwan et al.","title":"Cannabinoids, Phenolics, Terpenes and Alkaloids of Cannabis","doi":"10.3390/molecules26092774","url":"https://doi.org/10.3390/molecules26092774","use":"Immutable 125-record historical baseline and 11-subclass numbering."},{"source_id":"SRC-LINCIANO-2021","year":2021,"authors":"Linciano et al.","title":"The novel heptyl phorolic acid cannabinoids content in different Cannabis sativa L. accessions","doi":"10.1016/j.talanta.2021.122704","url":"https://doi.org/10.1016/j.talanta.2021.122704","use":"CBDPA and THCPA confirmed against synthesized standards; CBGPA/CBCPA putative detections; other C7 acids searched."},{"source_id":"SRC-BIOSYNTHESIS-2021","year":2021,"authors":"Thomas et al.","title":"The biosynthesis of the cannabinoids","doi":"","url":"https://pmc.ncbi.nlm.nih.gov/articles/PMC7962319/","use":"Core CBGA → THCA/CBDA/CBCA pathway and non-enzymatic decarboxylation framing; THCA-B occurrence caution."},{"source_id":"SRC-NRF2-2022","year":2022,"authors":"Taglialatela-Scafati et al.","title":"A Nrf-2 Stimulatory Hydroxylated Cannabidiol Derivative from Hemp (Cannabis sativa)","doi":"10.1021/acs.jnatprod.1c01198","url":"https://doi.org/10.1021/acs.jnatprod.1c01198","use":"Three new hydroxylated CBD analogues; first natural isolation of anhydrocannabimovone."},{"source_id":"SRC-FUTURA-2022","year":2022,"authors":"De Vita et al.","title":"Phytochemical Analysis of the Methanolic Extract and Essential Oil from Leaves of Industrial Hemp Futura 75 Cultivar","doi":"10.3390/plants11131671","url":"https://doi.org/10.3390/plants11131671","use":"New 2α-hydroxy-Δ3,7-cannabitriol."},{"source_id":"SRC-CIS-THCA-2022","year":2022,"authors":"Tolomeo et al.","title":"Cis-Δ9-tetrahydrocannabinolic acid occurrence in Cannabis sativa L.","doi":"10.1016/j.jpba.2022.114958","url":"https://doi.org/10.1016/j.jpba.2022.114958","use":"First identification and validated quantification of cis-Δ9-THCA in Cannabis."},{"source_id":"SRC-WELLING-2022","year":2022,"authors":"Welling et al.","title":"Biosynthetic origins of unusual cannabimimetic phytocannabinoids in Cannabis sativa L: A review","doi":"10.1016/j.phytochem.2022.113282","url":"https://doi.org/10.1016/j.phytochem.2022.113282","use":"Modern scope check: literature describes >160 isoprenylated resorcinyl polyketides; biosynthetic origins of many minor analogues remain unresolved."},{"source_id":"SRC-GARGIULO-2024","year":2024,"authors":"Gargiulo et al.","title":"Phytochemical Characterization and TRPA1/TRPM8 Modulation Profile of the Cannabigerol-Rich Cannabis sativa L. Chemotype IV","doi":"10.1021/acs.jnatprod.3c00831","url":"https://doi.org/10.1021/acs.jnatprod.3c00831","use":"Nine new phytocannabinoids (5–13), fully characterized by HR-ESIMS and 1D/2D NMR."},{"source_id":"SRC-EPICBD-2024","year":2024,"authors":"Primary study","title":"A novel cannabinoid in hemp: Isolation by flash chromatography and identification by liquid chromatography high resolution mass spectrometry","doi":"10.1016/j.talo.2024.100332","url":"https://doi.org/10.1016/j.talo.2024.100332","use":"Epicannabidiol hydrate isolated and structure verified by LC/Q-TOF-MS and NMR."},{"source_id":"SRC-CBE-2025","year":2025,"authors":"Nguyen et al.","title":"New Cannabinoids and Chlorin-Type Metabolites from the Flowers of Cannabis sativa L.","doi":"10.3390/ph18040521","url":"https://doi.org/10.3390/ph18040521","use":"Cannabielsoxa isolated and characterized; chlorin-type discoveries routed outside cannabinoid canon."},{"source_id":"SRC-CBGD-2025","year":2025,"authors":"Pozzi et al.","title":"Cannabizetol, a Novel Cannabinoid: Chemical Synthesis, Anti-inflammatory Activity and Extraction from Cannabis sativa L.","doi":"10.1021/acs.jnatprod.5c00826","url":"https://doi.org/10.1021/acs.jnatprod.5c00826","use":"Cannabizetol first isolated; exact match to synthesized standard; methylene-bridged dimeric cannabinoid."},{"source_id":"SRC-CIS-BIO-2026","year":2026,"authors":"Targeted phytocannabinomics study","title":"Targeted phytocannabinomics provides new insights into the biosynthetic origin of cis-Δ9-THCA in Cannabis sativa L.","doi":"10.1016/j.jpba.2026.117510","url":"https://doi.org/10.1016/j.jpba.2026.117510","use":"cis-THCA not consistent with simple chemical derivation; parallel accumulation with CBCA suggests possible CBCA synthase involvement."},{"source_id":"SRC-PHENOLICS-2025","year":2025,"authors":"Muller & de Villiers","title":"Comprehensive profiling of phenolic compounds in Cannabis sativa using two-dimensional liquid chromatography coupled to high-resolution mass spectrometry","doi":"10.1016/j.chroma.2025.466023","url":"https://doi.org/10.1016/j.chroma.2025.466023","use":"Route to non-cannabinoid Atlas branches; tentative phenolics/flavoalkaloids, not cannabinoid canon."}]